<?xml version="1.0" encoding="UTF-8"?>
<tns:BIMRule schemaVersion="0.1" xmlns:tns="http://inf.bi.rub.de/OpenBimRL" xmlns:xsi="http://www.w3.org/2001/XMLSchema-instance" xsi:schemaLocation="http://inf.bi.rub.de/OpenBimRL OpenBimRL.xsd">
	<tns:Precalculations>
		<tns:Node id="85d5009c-f8dc-1ccf-66c8-ce610713793a" function="ifc.getProperty" alias="Example Text Here">
			<tns:Inputs>
				<tns:Input name="IfcElement"/>
				<tns:Input name="PropertySetName"/>
				<tns:Input name="PropertyName"/>
			</tns:Inputs>
			<tns:Outputs>
				<tns:Output name="value"/>
			</tns:Outputs>
		</tns:Node>
		<tns:Node id="6ba3cccc-4a01-bc7a-fd91-e3ca9a717c52" function="input.textInput">
			<tns:Outputs>
				<tns:Output name="text" value="Pset_WallCommon"/>
			</tns:Outputs>
		</tns:Node>
		<tns:Node id="c37f31a8-265b-9fab-3363-67a516e49f96" function="input.textInput">
			<tns:Outputs>
				<tns:Output name="text" value="LoadBearing"/>
			</tns:Outputs>
		</tns:Node>
		<tns:Node id="bb426f64-8658-e235-e8fa-aec86ff5d78c" function="input.textInput">
			<tns:Outputs>
				<tns:Output name="text" value="IfcWall"/>
			</tns:Outputs>
		</tns:Node>
		<tns:Node id="bc2a7431-9376-db5d-a12a-fe48e83bddbd" function="ifc.filterByElement" alias="Example Text Here">
			<tns:Inputs>
				<tns:Input name="IfcType"/>
			</tns:Inputs>
			<tns:Outputs>
				<tns:Output name="IfcElement_List"/>
			</tns:Outputs>
		</tns:Node>
		<tns:Node id="6d2cd2a8-079f-6108-53e8-3cc8553c7748" function="ifc.getAllPropertySetInformation" alias="Example Text Here">
			<tns:Inputs>
				<tns:Input name="IfcElement"/>
			</tns:Inputs>
			<tns:Outputs>
				<tns:Output name="Map of PropertyInfo"/>
			</tns:Outputs>
		</tns:Node>
		<tns:Node id="6aae2d89-1437-df28-ebdf-72b8dad84b77" function="input.textInput">
			<tns:Outputs>
				<tns:Output name="text" value="IfcObject"/>
			</tns:Outputs>
		</tns:Node>
		<tns:Node id="a018968c-2131-2498-85eb-af68d568c668" function="ifc.filterByElement" alias="Example Text Here">
			<tns:Inputs>
				<tns:Input name="IfcType"/>
			</tns:Inputs>
			<tns:Outputs>
				<tns:Output name="IfcElement_List"/>
			</tns:Outputs>
		</tns:Node>
		<tns:Node id="38e85418-b007-29d8-3068-4ffd1a989f75" function="ifc.getIfcType" alias="Example Text Here">
			<tns:Inputs>
				<tns:Input name="IfcElement"/>
			</tns:Inputs>
			<tns:Outputs>
				<tns:Output name="IfcType"/>
			</tns:Outputs>
		</tns:Node>
		<tns:Edge id="953a5a9a-d90f-d80b-8b3a-85586e15b885" source="6ba3cccc-4a01-bc7a-fd91-e3ca9a717c52" sourceHandle="0" target="85d5009c-f8dc-1ccf-66c8-ce610713793a" targetHandle="1"/>
		<tns:Edge id="8bee1359-1d92-5285-2656-99e8cdcfaa3d" source="c37f31a8-265b-9fab-3363-67a516e49f96" sourceHandle="0" target="85d5009c-f8dc-1ccf-66c8-ce610713793a" targetHandle="2"/>
		<tns:Edge id="459378e2-3ee4-92ea-4d46-54dd0b3676cc" source="bb426f64-8658-e235-e8fa-aec86ff5d78c" sourceHandle="0" target="bc2a7431-9376-db5d-a12a-fe48e83bddbd" targetHandle="0"/>
		<tns:Edge id="484671e2-884e-364f-574e-c869de166e12" source="bc2a7431-9376-db5d-a12a-fe48e83bddbd" sourceHandle="0" target="85d5009c-f8dc-1ccf-66c8-ce610713793a" targetHandle="0"/>
		<tns:Edge id="780178d2-4bf2-a9ec-9e78-453dcc07e65d" source="6aae2d89-1437-df28-ebdf-72b8dad84b77" sourceHandle="0" target="a018968c-2131-2498-85eb-af68d568c668" targetHandle="0"/>
		<tns:Edge id="0cd89868-84ce-d26c-e0a8-0808ded60de8" source="a018968c-2131-2498-85eb-af68d568c668" sourceHandle="0" target="6d2cd2a8-079f-6108-53e8-3cc8553c7748" targetHandle="0"/>
		<tns:Edge id="adc8ab56-8068-e44a-2598-bde8e3d82e0c" source="a018968c-2131-2498-85eb-af68d568c668" sourceHandle="0" target="38e85418-b007-29d8-3068-4ffd1a989f75" targetHandle="0"/>
	</tns:Precalculations>
	<tns:ModelCheck name="Formelle Prüfung von tragfähikeits Eigenschaften von Wänden">
		<tns:RuleIdentifiers>
			<tns:RuleIdentifier label="propertyValue" source="85d5009c-f8dc-1ccf-66c8-ce610713793a" sourceHandle="0"/>
			<tns:RuleIdentifier label="ifcWallEntities" source="bc2a7431-9376-db5d-a12a-fe48e83bddbd" sourceHandle="0"/>
			<tns:RuleIdentifier label="propertyInfos" source="6d2cd2a8-079f-6108-53e8-3cc8553c7748" sourceHandle="0"/>
			<tns:RuleIdentifier label="ifcTypes" source="38e85418-b007-29d8-3068-4ffd1a989f75" sourceHandle="0"/>
			<tns:RuleIdentifier label="ifcEntities" source="a018968c-2131-2498-85eb-af68d568c668" sourceHandle="0"/>
		</tns:RuleIdentifiers>
		<tns:ModelSubChecks>
			<tns:ModelSubCheck name="Check PropertySet by Values">
				<tns:Rules label="77dd6850-f1d7-4c13-81e0-2de33fbf06cc" operator="or">
					<tns:Rule label="check01" quantifier="exists" operator="equals" operand1="propertyValue" operand2="true"/>
					<tns:Rule label="check02" quantifier="exists" operator="equals" operand1="propertyValue" operand2="false"/>
				</tns:Rules>
			</tns:ModelSubCheck>
			<tns:ModelSubCheck name="Check PropertySet by PropertyInfos">
				<tns:Rules label="3129cd4c-e3d0-4c02-8250-01a4da1c1508" operator="and">
					<tns:Rule label="check03" quantifier="exists" operator="equals" operand1="propertyInfos" operand2="Pset_WallCommon:LoadBearing:true"/>
					<tns:Rule label="check04" quantifier="exists" operator="equals" operand1="propertyInfos" operand2="Pset_WallCommon:LoadBearing:false"/>
					<tns:Rule label="check05" quantifier="exists" operator="equals" operand1="ifcTypes" operand2="IfcWall"/>
				</tns:Rules>
			</tns:ModelSubCheck>
		</tns:ModelSubChecks>
		<tns:ResultSets>
			<tns:ResultSet name="PropertySet by Values [true]" elements="ifcWallEntities" filter="check01"/>
			<tns:ResultSet name="PropertySet by Values [false]" elements="ifcWallEntities" filter="check02"/>
			<tns:ResultSet name="PropertySet by PropertyInfos Selection [true]" elements="ifcEntities" filter="check05 AND check03"/>
			<tns:ResultSet name="PropertySet by PropertyInfos Selection [false]" elements="ifcEntities" filter="check05 AND check04"/>
			<tns:ResultSet name="PropertySet by PropertyInfos Filtered Entities" elements="ifcEntities" filter="check05"/>
		</tns:ResultSets>
	</tns:ModelCheck>
</tns:BIMRule>